Tweet ID,Usuario,Contenido,Fecha,Lenguaje,Sentimiento,texto_limpio
771036947108200448,HectorMann8,Los ministerios q os tienen a vosotros engañando maca conmigo tenías q dar @Rafa_Hernando q t iba a dar un baño así d paso t lavas l boca ,2016-08-31 17:28:28,es,negative,ministerios q vosotros engañando maca conmigo q dar q t iba dar baño así d paso t lavas l boca
771030279616077824,Addri_12,"Esto es tan surrealista 😂 Pues nada, la cuenta de twitter de PewDiePie a la puta ",2016-08-31 17:01:58,es,negative,tan surrealista pues cuenta twitter pewdiepie puta
771032540652113920,_sws___,@luciaanagil illo que ya me han enviado 5 personas diferentes snpachats con palomitas ,2016-08-31 17:10:57,es,neutral,illo enviado 5 personas diferentes snpachats palomitas
771041317803724800,AliciaPosse,Cuando le mandas a tu profesor algo para corregir y te lo reenvía corregido y está todo mal  solo me queda llorar,2016-08-31 17:45:50,es,negative,mandas profesor corregir reenvía corregido mal solo queda llorar
771043016106708992,LytosOfficial,Estos días me encuentro muy débil... espero que se me pase pronto!!! ,2016-08-31 17:52:34,es,negative,días encuentro débil espero pase pronto
771042560424943616,EseEsElHombre,Putada lv se me jodió la ruedecita del ratón y bueno ,2016-08-31 17:50:46,es,negative,putada lv jodió ruedecita ratón bueno
771027072047132672,complejisimus,"@Walter_Sobchak1 Por cierto Walter,genial lo d echarle las cenizas al Donie ",2016-08-31 16:49:13,es,positive,cierto waltergenial d echarle cenizas donie
771025951866126336,lovesickdaniel,"@livingjacob tu lo tienes facil, vives al lado de madrid ",2016-08-31 16:44:46,es,neutral,facil vives lado madrid
771065990134239236,XDPOKEMON4EVER,Creo k es la primera vez k estoy deseando k llegue septiembre de una vez ,2016-08-31 19:23:52,es,positive,creo k primera vez k deseando k llegue septiembre vez
771065591079833601,Ralbarn,"@senior_Esfera qué va, son tranquilas, nunca logra refutarme nada ",2016-08-31 19:22:17,es,positive,va tranquilas nunca logra refutarme
771064143965282304,pablosiana,"Que #Rajoy no logre la #investiduraRajoy NO ES NOTICIA, lo contrario sí... Pero serán becarios los que están en prácticas ",2016-08-31 19:16:32,es,negative,rajoy logre investidurarajoy noticia contrario becarios prácticas
771064133060026368,99sdarpe,@BernaRios9 @gottabebravery_ yo ya estoy arruinada con tanto verano Berni ,2016-08-31 19:16:29,es,negative,arruinada verano berni
771064025161621508,Irati_Smile,Primer día de la operación bikini 2017 superado.. I can!  #altafitdonosti #objetivospartan2017,2016-08-31 19:16:03,es,positive,primer día operación bikini 2017 superado i can altafitdonosti objetivospartan2017
771063610386841600,Patry_024,"No se cuantas veces la abre escuchado, pero no me canso de hacerlo y es que suena tan bien juntos @MisElizaJane 
https://t.co/KVPc6WiIGU",2016-08-31 19:14:25,es,positive,cuantas veces abre escuchado canso hacerlo suena tan bien juntos httpstcokvpc6wiigu
771062102106763267,andcherk,"@albeferrando @DGTes Hola Alberto. Tengo la misma problema, he perdido unas horas  ¿Lo has obtenido? #dgtes",2016-08-31 19:08:25,es,negative,hola alberto misma problema perdido unas horas obtenido dgtes
771044728976642052,LiveNationES,"@hollagher Si lo compraste con tarjeta no tienes que hacer nada, si es en efectivo imagino que cualquier FNAC vale. ",2016-08-31 17:59:23,es,neutral,si compraste tarjeta hacer si efectivo imagino cualquier fnac vale
771069415710490630,nikoporu,Se qué razas están entre mis preferencias... pero va a ser muy difícil adoptar alguna de ellas ,2016-08-31 19:37:29,es,negative,razas preferencias va ser difícil adoptar alguna
771073172271730688,ziganda,"@Orion_Pirata abcesos de pus en la espalda, pero coge el alta el día 8. ",2016-08-31 19:52:24,es,neutral,abcesos pus espalda coge alta día 8
771072149742387202,AnitaCaffeina,@quinno_ Bajón + Ed Sheeran llorera asegurada. Me pasa ,2016-08-31 19:48:20,es,negative,bajón ed sheeran llorera asegurada pasa
771071912420188161,DelecturaOblig,@Quesadacid muchas gracias Rodrigo por compartir con nosotros su paso por la Feria del Libro de Benidorm. Esperamos que le haya encantado ,2016-08-31 19:47:24,es,positive,muchas gracias rodrigo compartir paso feria libro benidorm esperamos encantado
771071874772135938,AurynerdeunER,"Más bonito no puede ser 
Por cierto,me alegro mucho por la mención https://t.co/NAm5mf5Nz1",2016-08-31 19:47:15,es,positive,bonito puede ser ciertome alegro mención httpstconam5mf5nz1
771024885988618240,Lynx_Moon,@Garabatos ya estás aquí? 😂😂 Esta semana lo tengo complicado pero a la otra vamos ,2016-08-31 16:40:32,es,neutral,aquí semana complicado vamos
771024597978345473,alvaroshutter,@arivero la web que tenías para ver los pokemon que veian tus rastreadores ya no funciona? Que llevo dos días entrando y ya no va ,2016-08-31 16:39:23,es,negative,web ver pokemon veian rastreadores funciona llevo dos días entrando va
771023798971822080,iriayselene,@_Raquel97_ ¡Muchísimas gracias! Ojalá te llegue prontito y lo disfrutes un montón ,2016-08-31 16:36:13,es,positive,muchísimas gracias ojalá llegue prontito disfrutes montón
771095991181279232,AdrienFowl,30 años viviendo en #Algeciras y cuando me vengo a vivir a #Sevilla es cuando pasan las cosas divertidas como un #terremoto. ,2016-08-31 21:23:05,es,negative,30 años viviendo algeciras vengo vivir sevilla pasan cosas divertidas terremoto
771101604305051648,cienciabrujula,@ElSpeaker La vida nos lleva por caminos inextricables jajaja Me alegro de que te haya molado el programa de hoy ,2016-08-31 21:45:23,es,positive,vida lleva caminos inextricables jajaja alegro molado programa hoy
771100160868880384,AISSanguesa,¡¡No a las agresiones sexistas durante y después de las Fiestas!!  #Sangüesa,2016-08-31 21:39:39,es,negative,agresiones sexistas después fiestas sangüesa
771100028073086976,NoSoyUnPlaneta,@WingedArrow_ @redskyF2 si pero es de Mario joder comprate una propia ,2016-08-31 21:39:07,es,negative,si mario joder comprate propia
771099612086140928,elevenfemixunga,Mi corasonsito me pide a gritos Clexa fanfics pero de los bonitos profundos que te dejan llorando ,2016-08-31 21:37:28,es,positive,corasonsito pide gritos clexa fanfics bonitos profundos dejan llorando
771099369122697216,audreymolgar,"@audreymolgar ay si, pero no puedo cambiar el username y soy un numero raro  aiuda",2016-08-31 21:36:30,es,negative,ay si puedo cambiar username numero raro aiuda
771099060031856642,ParanoidNeva,"@Fourty35 



Si mañana sigues malita te dedico una canción.

(Mía no ",2016-08-31 21:35:16,es,neutral,si mañana sigues malita dedico canción
771103351073275904,Chaves_4,@johanna_196 el sábado unas risas todos juntos... A por otro año más! ,2016-08-31 21:52:19,es,positive,sábado unas risas juntos año
771102795533615105,cienciabrujula,"@ElSpeaker Es un aspecto poco conocido del Sistema Solar, que probablemente aún haya cosas por descubrir ahí fuera ",2016-08-31 21:50:07,es,positive,aspecto conocido sistema solar probablemente aún cosas descubrir ahí
771102706970877952,Akrillex17,@PitDiamondcore  Que cabrones..... puffff  .... Bueno se empieza de nuevo no pasa nada jejej ,2016-08-31 21:49:46,es,neutral,cabrones puffff bueno empieza nuevo pasa jejej
771074285423263748,CliftJose,"@javier_depecos Otro para ti Javier, me ha hecho mucha ilusión tu respuesta. Gracias de corazón  feliz noche.",2016-08-31 19:56:50,es,positive,javier hecho mucha ilusión respuesta gracias corazón feliz noche
771047602569801729,ArniSalvi,@OriannaSenpaii conmigo siemprw puedes hablar ,2016-08-31 18:10:48,es,positive,conmigo siemprw puedes hablar
771047490179198976,n_everdeen,#HappyJungkookDay #꾹이생일ㅊㅋ Galleta bonita *.* Feliz cumpleaños al mejor maknae del mundo ,2016-08-31 18:10:21,es,positive,happyjungkookday 꾹이생일ㅊㅋ galleta bonita feliz cumpleaños mejor maknae mundo
771046775268466688,StrongbyJacks,@AlvaroAuryn en noja estuviste genial pero ¿sabes una cosa? Nos vemos en madrid para despedirnos  #askalvarogango,2016-08-31 18:07:31,es,positive,noja genial sabes cosa vemos madrid despedirnos askalvarogango
771051726694744064,Elena521,"Chicxs nunca idealicéis demasiado a una persona, que luego os da mg en facebook y rompéis un espejo de la emoción ",2016-08-31 18:27:11,es,negative,chicxs nunca idealicéis demasiado persona luego da mg facebook rompéis espejo emoción
771051145032765440,calfofduty10021,@GamerXtraX Aun no  No tengo algunas legendarias aun ,2016-08-31 18:24:53,es,negative,aun legendarias aun
771053662336651264,naatmaribona_,Tengo tantísimo sueño que cada vez que me levanto y ando me choco con la pared en serio me siento súper gilipollas ,2016-08-31 18:34:53,es,negative,tantísimo sueño cada vez levanto ando choco pared serio siento súper gilipollas
771053422518931457,verii_180,"3 años siguiéndote y ni una mención, con lo que te quiero  @AlvaroAuryn  #askalvarogango",2016-08-31 18:33:56,es,negative,3 años siguiéndote mención quiero askalvarogango
771055330117779456,verii_180,"Me haces bullying intenso, me vas a hacer caso algún día?  @AlvaroAuryn  #askalvarogango",2016-08-31 18:41:30,es,negative,haces bullying intenso vas hacer caso algún día askalvarogango
771057243550801920,JavierRubia92,"@Dalek_fan qué va  me levanté agotado, de no poder salir de la cama de las pocas fuerzas que tenía",2016-08-31 18:49:07,es,negative,va levanté agotado poder salir cama pocas fuerzas
771057046296879104,merceroura,"@crisasanz gracias, guapa!! menuda promoción me haces!! eres un sol ",2016-08-31 18:48:20,es,positive,gracias guapa menuda promoción haces sol
770989071015505920,IPrieto10,"@XimoVR @gsus_77 @mediavida5 lo bueno y lo malo, ojo. Que a nosotros fijo que nos quitan alguno. ",2016-08-31 14:18:13,es,negative,bueno malo ojo fijo quitan alguno
770988960906616832,Ann_Acid,Se ha ido de mi espalda y no se como ha acabado dejandome en una esquinita de mi propia cama ,2016-08-31 14:17:47,es,negative,ido espalda acabado dejandome esquinita propia cama
770980702636609537,kirsweg,"@LaPonyRosa nu , no sirve cualquiera  Lo probé hace poco para una app coreana y no me dejaba u^u por lo de la tarjeta de crédito",2016-08-31 13:44:58,es,negative,nu sirve cualquiera probé hace app coreana dejaba uu tarjeta crédito
770973163920453632,DeseoLiterario,@Lenavg3 jajajaja si si. Buscaré en Pinterest algo así  gracias 😘,2016-08-31 13:15:00,es,positive,jajajaja si si buscaré pinterest así gracias
770977393469165568,noseashetero,@noseashetero 10/10 lindo a ver si vuelves a León que se te echa de menos por aquí  quiero abrazarte ✨,2016-08-31 13:31:49,es,positive,1010 lindo ver si vuelves león echa menos aquí quiero abrazarte
770976788222734336,OskarGoVi,"@aaron_np @OjeraFarlopera_ @Nerea_RMCF93 somos antifas y bebemos agua de pantanos que hizo Franco.... que pena  
Mira, me meo 😂😂",2016-08-31 13:29:25,es,negative,antifas bebemos agua pantanos hizo franco pena mira meo
770976716412116992,PattyCavallone,"@LuciaDollface Ya ves, parece un comic más maduro pero el dibujo se delata solo ",2016-08-31 13:29:07,es,neutral,ves parece comic maduro dibujo delata solo
770996737121087492,oscsg,@oh_gabi genial! Ahora ya mucho mejor que con las tres primeras aún así todavía hay cosas que pulir ,2016-08-31 14:48:41,es,positive,genial ahora mejor tres primeras aún así todavía cosas pulir
770995646832803840,quintanapaz,"@UnAustracista @CarlesRH Metáfora=Comparación, que es lo que dije. Un poquito de teoría literaria ",2016-08-31 14:44:21,es,negative,metáforacomparación dije poquito teoría literaria
770953218922799104,quintanapaz,@agarotadipanema @montano66 Yo solo cité la gran definición que dio de ellos muy pronto el artista Omar Jerez ,2016-08-31 11:55:45,es,positive,solo cité gran definición dio pronto artista omar jerez
770982171142189056,OskarGoVi,"@aaron_np @OjeraFarlopera_ @livetodie77 @Nerea_RMCF93 no tenemos para cerveza, somos pobres y sucios. No nos dejan entrar al bar ",2016-08-31 13:50:48,es,negative,cerveza pobres sucios dejan entrar bar
771023324348637184,luisnova_9,@Putaqueen7 esta la página petada desde hace días ,2016-08-31 16:34:20,es,neutral,página petada hace días
771022271980920832,rauljerico,"@cantagalli Pasa el link de la mas interesante please, por no ver 5 veces lo mismo ",2016-08-31 16:30:09,es,negative,pasa link mas interesante please ver 5 veces mismo
771089570691682304,muguruzo94,Mingafria harrison. Si por un casual consigues ganar me pagas la noche de hoy. No te meto presión. Tu verás. ,2016-08-31 20:57:34,es,neutral,mingafria harrison si casual consigues ganar pagas noche hoy meto presión verás
771089200234070017,iriayselene,Os recomendamos seguir las listas porque Spotify no nos permite tenerlas públicas y colaborativas al mismo tiempo ,2016-08-31 20:56:06,es,negative,recomendamos seguir listas spotify permite tenerlas públicas colaborativas mismo tiempo
771093303995600898,GemaCouto,@JL_Blanco Gracias por la información. Parece que el olor ha cesado. Ayer pasó lo mismo sobre la misma hora ,2016-08-31 21:12:24,es,negative,gracias información parece olor cesado ayer pasó mismo misma hora
771092584538120194,Alis_8496,@Paco_Pinero Pero ya te digo que me encantaría tener esta conversación contigo en otras circunstancias ,2016-08-31 21:09:33,es,neutral,digo encantaría tener conversación contigo circunstancias
771094133805023233,simpy322,Hay que respetar las posturas de todo el mundo frente a las situaciones que se le presentan. Por algo no somos todos iguales ,2016-08-31 21:15:42,es,neutral,respetar posturas mundo frente situaciones presentan iguales
771114527299690496,itsannhere,"@paulakuyen 🐥

-tu pelo
-eres una de mis mejores amigas
-no mereces estar mal por nadie 
-compañera pastel!",2016-08-31 22:36:44,es,neutral,pelo mejores amigas mereces mal nadie compañera pastel
771114274387267584,neussgutierrez,"@jc_pblanco ya.. se le va, pero me gustó igual  lo siento, sino.. BLME está bien adaptado o los libros de Sparks ",2016-08-31 22:35:44,es,positive,va gustó igual siento sino blme bien adaptado libros sparks
771118203661586432,osnapitzmireia,"entre odio día tras día, la muerte de su hermana, la muerte de su amiga, el divorcio de sus padres cuando era pequeña, el lupus, etc ",2016-08-31 22:51:21,es,negative,odio día tras día muerte hermana muerte amiga divorcio padres pequeña lupus etc
771117405460369413,mariaasm12,"@ViKo_LH mira hijo de puta me cago en tu puta madre JAJAJAJAJAJAJJAAJAJA ya podré ir en 2018, ya... ",2016-08-31 22:48:10,es,negative,mira hijo puta cago puta madre jajajajajajajjaajaja podré ir 2018
771118596969857024,CesarHurtado,"@AmuntValencia_ No te preocupes, pero como hay tanta mala baba en Twitter pensaba que había sido por eso ",2016-08-31 22:52:54,es,neutral,preocupes tanta mala baba twitter pensaba sido
770553276894961664,kimeAs,"@YooHooKane @Stellone_Cthun eres un sinvergüenza,hay ke dormir mas,yo he dormio 6 horas (porke no tengo legion hasta hoy) ",2016-08-30 09:26:32,es,negative,sinvergüenzahay ke dormir masyo dormio 6 horas porke legion hoy
770551042639626240,MariaFlorBlanco,"@JVSantacreu  Gran experta Rosa en freir huevos, parecen gemelos. (a mí no me salen tan iguales) ",2016-08-30 09:17:39,es,positive,gran experta rosa freir huevos parecen gemelos salen tan iguales
770550930534170624,JohannSoirees,"Buenos días Magaluf !  👌🏻✅
• @BHmallorca • #BHmallorca#Magaluf #Mallorca #Island #Summer2016… https://t.co/amAnsSDaxI",2016-08-30 09:17:12,es,positive,buenos días magaluf bhmallorcamagaluf mallorca island summer2016 httpstcoamanssdaxi
770550385404678144,l0velyhar0ld,he soñado una cosa muy rara con los personajes de PLL y luego como que estaba en la real life y conocia a Shay y a Lucy y y y ,2016-08-30 09:15:02,es,negative,soñado cosa rara personajes pll luego real life conocia shay lucy
770559192109289472,gorkanunez,"Buenos días, @eslosiguiente . Lo siguiente de triste es abatido. 
Ánimo que siempre que llueve escampa. ",2016-08-30 09:50:02,es,negative,buenos días siguiente triste abatido ánimo siempre llueve escampa
770520720099176448,gmoret,@escolano y és una lastima porque tiene muy buenas ideas de diseño y al no pasar por Java rinden guay...pero MicroSoft y sus cosas ,2016-08-30 07:17:09,es,negative,és lastima buenas ideas diseño pasar java rinden guaypero microsoft cosas
770471105131929600,Thranduilina,"Nuevo trailer! #PokemonGo en minecraft! Espero que os gusten las pokecasas  os las imaginabais así por dentro? 

https://t.co/D2sH0op1ei",2016-08-30 04:00:00,es,positive,nuevo trailer pokemongo minecraft espero gusten pokecasas imaginabais así dentro httpstcod2sh0op1ei
770548468347699200,ConRaizz,"Han llegado las primeras #granadas   La primera ensalada con tintes otoñales cae hoy! 
#eco… https://t.co/DICRGhwe5X",2016-08-30 09:07:25,es,positive,llegado primeras granadas primera ensalada tintes otoñales cae hoy eco httpstcodicrghwe5x
770547133846024192,lramosneira,@julwiki no sabía que la remasterizada se parecía a la primera temporada de Falcon Crest ,2016-08-30 09:02:07,es,neutral,sabía remasterizada parecía primera temporada falcon crest
770033138819104768,6_LP,"@_ArtificialRed_ gracias tocaya  Pero.. es que es verdad da rabia.. ni un extremo ni otro, si hay machismo voy a ser la primera que va..",2016-08-28 22:59:41,es,negative,gracias tocaya verdad da rabia extremo si machismo voy ser primera va
769977731295698944,Romana40,"@NovatilloTotal ahora escribo las cartas. Seprona no, qué por suerte me han cuidado Pepito muy bien ",2016-08-28 19:19:31,es,positive,ahora escribo cartas seprona suerte cuidado pepito bien
769980058761068547,neussgutierrez,"@RanLuna13 la Odisea es uno de mis libros favoritos, y de Shakespeare por ejemplo me encanta Hamlet ",2016-08-28 19:28:46,es,positive,odisea libros favoritos shakespeare ejemplo encanta hamlet
769979431163224064,neussgutierrez,"@SilversunRhythm bueno, Los miserables es un libro ""pesado"" o el Silmarillion, y amo los dos, así que valdrá la pena ",2016-08-28 19:26:16,es,positive,bueno miserables libro pesado silmarillion amo dos así valdrá pena
770055276242305026,alvarxshoo,@HausofMai @julenfenty ha sido genial conocerte maite te quiero mucho en serio una monada de chica ,2016-08-29 00:27:39,es,positive,sido genial conocerte maite quiero serio monada chica
770219445272936448,alcarajo__,hoy me han traído a mi perra después de seis días sin verla y está to nerviosa y más delgada ,2016-08-29 11:20:00,es,negative,hoy traído perra después seis días verla to nerviosa delgada
770191925852966912,nereust777,"dreamer para siempre  @OfficialCritika @OfficialSaik os quiero chicos 
quier abrazaros https://t.co/oLDFpQ0Cd9",2016-08-29 09:30:39,es,positive,dreamer siempre quiero chicos quier abrazaros httpstcooldfpq0cd9
770189160917458944,interporc,@josey_dani ¡Qué pintaza! Tanto la chistorra como el lomo son productos deliciosos. Probaremos vuestra sugerencia en frío y en bocadillo ,2016-08-29 09:19:40,es,positive,pintaza chistorra lomo productos deliciosos probaremos sugerencia frío bocadillo
770189062565158912,aladroqe,"@TeoGarciaEgea @paconadal De nuevo, encantado. Y a mi tampoco me gustan esos titulares tendenciosos. Pero tampoco los opuestos  Saludos.",2016-08-29 09:19:16,es,neutral,nuevo encantado tampoco gustan titulares tendenciosos tampoco opuestos saludos
770188631818563584,jdanielaguilar,@Candiecita tanto tiempo siguiéndote y leyendo las cosas bonitas q ponías y ahora ya no me dejas? ,2016-08-29 09:17:33,es,negative,tiempo siguiéndote leyendo cosas bonitas q ponías ahora dejas
770225071218626560,hermesni,@EspeculacionCP Échate años y muchas horas aprendiendo y practicando  podría ser un buen título.,2016-08-29 11:42:21,es,positive,échate años muchas horas aprendiendo practicando podría ser buen título
770224441838231552,gaab75,".@donecperficiam6 ¿Me dice garrullo, llamándose Domingo? Esa es buena  @RLEGAZ @UrsulaBayer @gabrielrufian",2016-08-29 11:39:51,es,neutral,dice garrullo llamándose domingo buena
770216597592113152,WarnerMusicES,"@raquel_lpz Hola Raquel. Ya avisamos que por desgracia hubo un cambio de planes y no podrán venir en 2016, estamos intentándolo para 2017 ",2016-08-29 11:08:41,es,negative,hola raquel avisamos desgracia cambio planes podrán venir 2016 intentándolo 2017
770239405722374144,SandraayusoSp,Me duele mucho la cabeza tio ,2016-08-29 12:39:19,es,negative,duele cabeza tio
770238107656589312,TostadoraAPilas,"@NereeSantome Nope, es respingona  De chiquitin el bullying con eso fue real.  Para bonita ya estás tú Nere ~",2016-08-29 12:34:09,es,neutral,nope respingona chiquitin bullying real bonita nere
770237198247559168,Iriagparente,@flyintothestorm @SelenePetalos Mmmm yo tampoco te puedo decir nada  Supongo que lo lógico sería que lo tuvieran pero a saber,2016-08-29 12:30:33,es,negative,mmmm tampoco puedo decir supongo lógico saber
770236842704826368,ManudoCapo,"@LionQueenOfJah No, somos egoístas por distintas circunstancias e intereses. Solos estamos todos socia, es cosa de hacerse ",2016-08-29 12:29:08,es,negative,egoístas distintas circunstancias intereses solos socia cosa hacerse
770235663946018817,RbnRguez23,He capturado mi primer gimnasio en el Pokemon Go. Cierto es que es probable que no tarden ni 10 minutos en quitarmelo. Pero mola ,2016-08-29 12:24:27,es,positive,capturado primer gimnasio pokemon go cierto probable tarden 10 minutos quitarmelo mola
770240922361663488,Silvi_ta,"Me hubiera encantado contaros el martirio de san Juan Bautista, que es como de peli. Con Herodes, Salomé...pero no me ha dado la vida ",2016-08-29 12:45:20,es,negative,encantado contaros martirio san juan bautista peli herodes salomépero dado vida
770227005719715841,Urticante,venga ya hombre jope tias yo quiero cosas intensas no me hagais estas preguntas ,2016-08-29 11:50:02,es,negative,venga hombre jope tias quiero cosas intensas hagais preguntas
770226078535315456,ManudoCapo,Quiero que te fijes en mi interior pero me pongo unas tetas de talla cien y el escote más grande que haya ,2016-08-29 11:46:21,es,negative,quiero fijes interior pongo unas tetas talla cien escote grande
770215059247210496,SanzIrles,@manozom @carisimolider No  Justamente el hilo empezó porque yo sostengo que Mason es un pésimo HH.,2016-08-29 11:02:34,es,negative,justamente hilo empezó sostengo mason pésimo hh
770213306510565377,Manuel180694,"@lococamionero  Otra cosa es que no tuviera seguridad social, porqe no era obligatorio en su situacion. Lee, los libros no muerden ",2016-08-29 10:55:36,es,negative,cosa seguridad social porqe obligatorio situacion lee libros muerden
770242564486291456,JMelero1,"@BetisFans7 @AntonioViola1 Yo solo por llamar a tu equipo ""EL GRANDE DE SEVILLA"" te bloqueaba Jojojojo ",2016-08-29 12:51:52,es,negative,solo llamar equipo grande sevilla bloqueaba jojojojo
770242545574113284,glowingseungri,"joder pobres hombres están oprimidos por mujeres que les obligan a afeitarse 
#justice4hombres https://t.co/C09iDQQr39",2016-08-29 12:51:47,es,negative,joder pobres hombres oprimidos mujeres obligan afeitarse justice4hombres httpstcoc09idqqr39
770098781744398338,xngelfurler,"Mañana me veré las que faltan, pero la mejor de la noche no ha sido Britney vaya  Me ha decepcionado",2016-08-29 03:20:31,es,negative,mañana veré faltan mejor noche sido britney vaya decepcionado
770079202817216513,nacho_merinob,"@jose97angel el canal de ""Global Talents"" suele ser rápido en subir actuaciones, valoraciones, previos, y resultados...   ",2016-08-29 02:02:43,es,positive,canal global talents suele ser rápido subir actuaciones valoraciones previos resultados
770203566170660864,AriDarkHime,"Pues mi cuerpo por dinero no he ofrecido, pero mi tiempo sí. En plan, si tienes la absurda idea de quedar conmigo, pagas tú TODO. ",2016-08-29 10:16:54,es,negative,pues cuerpo dinero ofrecido tiempo plan si absurda idea quedar conmigo pagas
770203207071047681,AndresMachoXIII,... pues no tengo exámenes en esas 2 semanas de margen. Ahora se viene la gran pregunta ¿iréis todos los que fuisteis a la MGW? ,2016-08-29 10:15:28,es,neutral,pues exámenes 2 semanas margen ahora viene gran pregunta iréis mgw
770201868819689472,grierfully,De verda soi tan lameculos ,2016-08-29 10:10:09,es,negative,verda soi tan lameculos
770268393312284672,thatsmxrinx,@judithgoan porque por no cargarlo con un cable oficial me he cargado la bat y el nuevo que me llega mañana es de sony ,2016-08-29 14:34:30,es,negative,cargarlo cable oficial cargado bat nuevo llega mañana sony
770270471199854592,DMrcd,"@cduranestany Es que se lee cada cosa , menos mal que a ese lo deje de seguir cuando terminó la temporada pasada .Mi salud es lo primero ",2016-08-29 14:42:45,es,negative,lee cada cosa menos mal deje seguir terminó temporada pasada salud primero
770246102541099009,albulapass_,@HijodeBilharzio Tengo la curiosa fortuna de que en estas semanas solo puede ver las etapas del finde ,2016-08-29 13:05:55,es,positive,curiosa fortuna semanas solo puede ver etapas finde
770245181111201793,Mari_Estopera,La Esteban promocionando el concierto de Estopa en Leganes...Que empiecen las bromas sin gracia sobre lo barriobajeres que somos todes ,2016-08-29 13:02:16,es,negative,esteban promocionando concierto estopa leganesque empiecen bromas gracia barriobajeres todes
770245060210417664,Rijoleau,Si Peter Iglesias le hubiese hecho caso a su segundo ya estaría el gobierno solucionado hace mucho ,2016-08-29 13:01:47,es,negative,si peter iglesias hecho caso segundo gobierno solucionado hace
770281535761223680,MiriamVilaplana,"@LoretoBazo Stranger y Mr. Robot ya las he visto, pero eres la segunda que me recomienda The get down, así que a por ella voy, gracias! ",2016-08-29 15:26:43,es,positive,stranger mr robot visto segunda recomienda the get down así voy gracias
