Tweet ID,Usuario,Contenido,Fecha,Lenguaje,Sentimiento,texto_limpio
769690910703616000,neussgutierrez,"@lekilig estaba en momento ""odio eterno"" necesitaba compartirlo  además yo hace poco que tengo canal y no me siento NADA identificada ",2016-08-28 00:19:47,es,negative,momento odio eterno necesitaba compartirlo además hace canal siento identificada
769688541299347456,neussgutierrez,@lekilig un hilo fabuloso  comparto todo lo que dices ^^,2016-08-28 00:10:23,es,positive,hilo fabuloso comparto dices
769713999776669696,NiievesGiil,@NiievesGiil si hubiese una opción de ''kill'' seguro que era la más votada ,2016-08-28 01:51:32,es,neutral,si opción kill seguro votada
769712850193551360,Jose_Rodriz,"@ivancastello Toca un tema maravilloso, porque sin dejar de ser ficción es algo que podría darse. Un Gran Hermano vol.02 ",2016-08-28 01:46:58,es,positive,toca tema maravilloso dejar ser ficción podría darse gran hermano vol02
769993102442524674,SalvaGJ99,@ImFebrer @MalagaCF Ninguno de los clubes lo hizo oficial pero se dice que sí ,2016-08-28 20:20:36,es,neutral,ninguno clubes hizo oficial dice
770010128720486400,StoneMagnet_,@ignatiareilly una oleada de cosas homófobas días anteriores ,2016-08-28 21:28:15,es,negative,oleada cosas homófobas días anteriores
770027650610003968,HuGo17__,@zKnowcks7 la culpa es de la gente que juega segunda no te engañes a ti mismo ,2016-08-28 22:37:52,es,negative,culpa gente juega segunda engañes mismo
770027144126881792,elputosocio,"@plsnomoredrama @Joseemiii @IsaMeseguerMtz @svvvdbxxy normal, con esa cara que tienes Alexia ",2016-08-28 22:35:52,es,neutral,normal cara alexia
770028464057483266,Czarunio20,@MigueZYT yo te felicitaria pero no me quedan caracteres en este tweet con lo cual lo siento mucho sera el año que viene  no te rayes bro,2016-08-28 22:41:06,es,negative,felicitaria quedan caracteres tweet siento sera año viene rayes bro
770026979047374849,ale_mastropiero,"Chatel con mis primos le hicimos un funeral a una lora de la casa de mis abuelos, cantando una adaptación de ""Querida"". DEP Juanga ",2016-08-28 22:35:12,es,negative,chatel primos hicimos funeral lora casa abuelos cantando adaptación querida dep juanga
770026405144952834,luisroldan_98,Tengo dos orzuelos enquistados en el ojo izquierdo y me hacen la cara muy asimétrica. Me veo raro ,2016-08-28 22:32:56,es,negative,dos orzuelos enquistados ojo izquierdo hacen cara asimétrica veo raro
769614591013814273,ofillodamparo,Vamos a enfrentarnos un poquito a fotos viejas ) apuf ,2016-08-27 19:16:31,es,negative,vamos enfrentarnos poquito fotos viejas apuf
769613629977223168,AndresMachoXIII,No hay nada como ver la semifinal masculina de La Nucía Open de Pádel mientras hago 30 min de bici estática a tope ,2016-08-27 19:12:42,es,positive,ver semifinal masculina nucía open pádel mientras hago 30 min bici estática tope
769613295011631105,imdariusb1tches,@Goonzas_ No voy ni a Vigo voy ir a Madrid? Jajajaja que vivo en Coruña tonto ,2016-08-27 19:11:22,es,negative,voy vigo voy ir madrid jajajaja vivo coruña tonto
769620986413080576,RiitalunaM,"¿Soy la única que no está viendo el partido? Aunque me gustaría, la verdad ",2016-08-27 19:41:56,es,negative,única viendo partido aunque gustaría verdad
769634809983434753,JustinWijnker,@AjaxAjaxcf no estoy convencido. P.e. Me gustaría ver a Cerny y Nouri en el 1r equipo y menos Gudelj y El Ghazi... Le doy tiempo.  (2/2),2016-08-27 20:36:52,es,negative,convencido pe gustaría ver cerny nouri 1r equipo menos gudelj ghazi doy tiempo 22
769634567917633536,caval100,"Somos los españoles cómplices de que gobierne el PP NO. Son sus cerca de 8 millones de votantes, de los más de 34 millones censados ",2016-08-27 20:35:54,es,negative,españoles cómplices gobierne pp cerca 8 millones votantes 34 millones censados
769610589542940676,yeradis,"@Maryansoy para el frio la solucion es hacer lo que dice esta frase ""sabado sabadete camisa nueva y ...."" ",2016-08-27 19:00:37,es,positive,frio solucion hacer dice frase sabado sabadete camisa nueva
769610090345275392,FINIKI_MR,@carlosmchef3 felicidades pareja!!! Peazo abuelo va a tener tu hijo....estará pletorico ,2016-08-27 18:58:38,es,positive,felicidades pareja peazo abuelo va tener hijoestará pletorico
769612941037568004,XDPOKEMON4EVER,@keirzar yo lo tengo facil  mi unicovy verdadero amor es pokemon ,2016-08-27 19:09:58,es,positive,facil unicovy verdadero amor pokemon
769612556587634688,Goonzas_,@imdariusb1tches es que que hacen tio ,2016-08-27 19:08:26,es,neutral,hacen tio
769636237984538624,aladroqe,"@vigarcu @saez_cristina @muyinteresante Están comenzando a hacerse un poco visibles ahora. Y ya van por su segundo modelo ""Fairphone 2"" ",2016-08-27 20:42:32,es,positive,comenzando hacerse visibles ahora van segundo modelo fairphone 2
769956993826160640,Reap_Jacker,Algún día dejaré de ver a Rem en mi TL y no recordaré a Subaru lo subnormal que fue de no escogerla. ,2016-08-28 17:57:07,es,negative,algún día dejaré ver rem tl recordaré subaru subnormal escogerla
769973260712865792,ElyShuri,"Lo siento mucho  bueno, os he dejado un vídeo de hype para el stream de mañana, que va a ser fuertesito",2016-08-28 19:01:45,es,negative,siento bueno dejado vídeo hype stream mañana va ser fuertesito
769972714820034565,emitiendo,"@bensonsenora El anuncio es cutre, cutre. 
Joseba quien es? ",2016-08-28 18:59:35,es,negative,anuncio cutre cutre joseba
770011857994276865,promeji,"@marcasgz te recuerdo que soy una persona que tiene criterio, equivocado, pero lo tengo ",2016-08-28 21:35:07,es,neutral,recuerdo persona criterio equivocado
769986689699876865,yer0al,@CesarCpi @Bl3sSuR @RetroTrainer Búscame un Zapdos de esos legales que tanto te gustan wapo  ,2016-08-28 19:55:07,es,positive,búscame zapdos legales gustan wapo
769988517975957505,AndresMachoXIII,"Buen amigo eres @Skyruss96, gracias por compartir tu pregunta en ese Ask 2.0 ",2016-08-28 20:02:23,es,positive,buen amigo gracias compartir pregunta ask 20
769987339187814400,merceroura,"@DavidArizaAbad buenas noches, David  un abrazo!",2016-08-28 19:57:41,es,positive,buenas noches david abrazo
770091323961532417,Veah9,Qué pobre soy no puedo ver los VMA ,2016-08-29 02:50:53,es,negative,pobre puedo ver vma
770087365796855808,MarinaLiaison,@MarinaLiaison quería poner me tenéis quemadísima pero no cabe y salen los puntitos ,2016-08-29 02:35:10,es,negative,quería poner quemadísima cabe salen puntitos
769864074582712321,hescentia,@EyeOfDavid__ te conocí y ya no te he vuelto a ver  me pareces super sincero y leal y me gusta hablar contigo,2016-08-28 11:47:53,es,positive,conocí vuelto ver pareces super sincero leal gusta hablar contigo
769863855451344896,abarbero,"@_aitor la verdad es que tiene buena pinta. Investigaré, gracias ",2016-08-28 11:47:01,es,positive,verdad buena pinta investigaré gracias
769863234946031617,DarcoTT,"Acabo de descubrir a Filip van der Cruyssen y sus increibles #fotografia de #retratos ...yo quiero 
 https://t.co/2T0S6DGxnm",2016-08-28 11:44:33,es,positive,acabo descubrir filip van der cruyssen increibles fotografia retratos quiero httpstco2t0s6dgxnm
769860293841354756,CliftJose,@springsteen_81 en España comemos (tragamos) de todo y con tod aquí esta trayectoria política parece normal. Saludos ,2016-08-28 11:32:52,es,negative,españa comemos tragamos tod aquí trayectoria política parece normal saludos
769860072503644160,SuperActrices,"@ElDesmarque_VCF Nunca había visto al Valencia el último de la Clasificación.  Que pasa con el Valencia, ya no ganamos.",2016-08-28 11:31:59,es,negative,nunca visto valencia último clasificación pasa valencia ganamos
769892151987675136,AriDarkHime,"@HeCalledMeAC Lo sé, a pesar de saber que no debería simplemente enamorarme de una cara bonita como la tuya... Soy muy superficial ",2016-08-28 13:39:27,es,negative,sé pesar saber debería simplemente enamorarme cara bonita superficial
769891966318501888,Gh14Yessi,"@kalvaniGH Pues yo no me crei esa expulsion, me parecio otro tongo como la de Ares, los dos mayores robados de aquella temporada ",2016-08-28 13:38:43,es,negative,pues crei expulsion parecio tongo ares dos mayores robados aquella temporada
769858499010564096,TeeDa5h,@alienmarica intenté eso el año pasado y mi móvil se hizo el loco con la alarma ,2016-08-28 11:25:44,es,negative,intenté año pasado móvil hizo loco alarma
769855141189132288,imobilis,"@themindcamp yooooo  seria novato, pero tengo charlas en la recámara ",2016-08-28 11:12:23,es,neutral,yooooo seria novato charlas recámara
769888991080427520,mikeltxo83,"@boteroBET @naitah77 hoy tocaba ir al del oeste, por cambiar. Sí, el cambio es a mejor ",2016-08-28 13:26:53,es,positive,hoy tocaba ir oeste cambiar cambio mejor
769888103242797056,AiryMadness,"@babi_dark_ si ya las hago, pero promocionarse es complicadillo  tengo pensado hacer un sorteo en poco",2016-08-28 13:23:22,es,negative,si hago promocionarse complicadillo pensado hacer sorteo
769887885818421248,abelgolden,"Como siempre mi tortilla triunfa mas que otros platos 
#playa… https://t.co/C60TC2teqV",2016-08-28 13:22:30,es,positive,siempre tortilla triunfa mas platos playa httpstcoc60tc2teqv
769887832194318336,AriDarkHime, por qué dices eso? Yo soy otaku y no hablo casi de aniJAJAJAJA era broma sis,2016-08-28 13:22:17,es,neutral,dices otaku hablo casi anijajajaja broma sis
769878004784852993,nuriamolines,"@rdelvalle, vaya, felicidades atrasadas y muchas gracias ",2016-08-28 12:43:14,es,positive,vaya felicidades atrasadas muchas gracias
769877190561398784,KowaiAlba,Me encanta como han decidido a que universidad voy a ir sin ni siquiera consultarmelo ,2016-08-28 12:40:00,es,negative,encanta decidido universidad voy ir siquiera consultarmelo
769885657816788992,Sulfurioso,"@GothicNekoGD Para Nigtwish tengo asiento, aunque fueramos juntos no podríamos sentarnos uno al lado del otro  
Para los otros tengo pista",2016-08-28 13:13:39,es,negative,nigtwish asiento aunque fueramos juntos podríamos sentarnos lado pista
769885529085190144,marinajholland,@ClauNavarro777 en verdad sí pero yo estuve intentando varias veces quedarme dormida ,2016-08-28 13:13:08,es,negative,verdad intentando varias veces quedarme dormida
769894591164219392,JanitaGB87,"Verano completito... Fuengirola, Peñiscola, Valle del Jerte, fiestas Sepul y próximamente --- fiestas Olmillo! ",2016-08-28 13:49:09,es,positive,verano completito fuengirola peñiscola valle jerte fiestas sepul próximamente fiestas olmillo
769894353389162497,hypocresia,"Y yo mientras comeré palomitas mientras quedáis retratados porque, ay, es lo que pasa cuando usas el activismo como un arma ",2016-08-28 13:48:12,es,negative,mientras comeré palomitas mientras quedáis retratados ay pasa usas activismo arma
769895102898638848,TeresaGarcia77,@Ivangomezruiz @TurismoAsturias De allí volvemos después de una semana espectacular ,2016-08-28 13:51:11,es,positive,allí volvemos después semana espectacular
769866755682492418,JavvoRockrawr,@lapollacaliente dos horitas más! Aunque me levanté destemplado ,2016-08-28 11:58:32,es,neutral,dos horitas aunque levanté destemplado
770994064451891200,Notreamitielove,Siempre las mejores personas son las que más sufren  #GetWellSoonSelenaFromSpain,2016-08-31 14:38:03,es,negative,siempre mejores personas sufren getwellsoonselenafromspain
771004220464070656,PauSkywalker_,"Es bastante patético, sobre todo que lo haga gente que prácticamente no me conoce de nada ",2016-08-31 15:18:25,es,negative,bastante patético haga gente prácticamente conoce
771004104021774336,KovuA7X,Lo único malo de Death Note es que dura muy poco. ,2016-08-31 15:17:57,es,negative,único malo death note dura
770957114273624065,StayTrueorGTFO,"@FemiHard_ Hmm no sé qué decirte, mientras no dejes la jaula abierta no pasa nada  Pero se recomienda que salgan un ratito al día +",2016-08-31 12:11:14,es,neutral,hmm sé decirte mientras dejes jaula abierta pasa recomienda salgan ratito día
770955429740417025,DbenavidesRMTV,@varitoponchito  es que las preguntas capciosas no están bien! Resultan muy periodísticas y poco consideradas ,2016-08-31 12:04:32,es,negative,preguntas capciosas bien resultan periodísticas consideradas
770990675080966144,_AlexBiker,@Sr_Merlusa @Mariiiiaperez @abrilnapilotti como se nota merlu que hace tiemp oque no te junta conmigoooooooo ,2016-08-31 14:24:35,es,negative,nota merlu hace tiemp oque junta conmigoooooooo
770990555333529600,Paarachute_,Estoy tan segura de que el exámen de mates va a ser el que hicimos de recuperación en el último trimestre al cual NADIE le sacó foto ,2016-08-31 14:24:07,es,neutral,tan segura exámen mates va ser hicimos recuperación último trimestre nadie sacó foto
770990366631788544,G0kuB,"No me refiero a vehiculos, me refiero a telefericos para llegar rapido a x zonas de vuestra (esperemos) gran base ",2016-08-31 14:23:22,es,neutral,refiero vehiculos refiero telefericos llegar rapido x zonas esperemos gran base
770990282817015808,AnarionLobogris,"@ladykumaria tranquila, te seguimos queriendo igual ",2016-08-31 14:23:02,es,positive,tranquila seguimos queriendo igual
771017206494822400,alvarxshoo,mi hermana kylie la vasca como la echo de menos ,2016-08-31 16:10:01,es,negative,hermana kylie vasca echo menos
771017151557828608,ElShuHermanoh,"No, solo quiero bailarte la medusa loca en privado  @GuiasTacticasES",2016-08-31 16:09:48,es,positive,solo quiero bailarte medusa loca privado
770988010229891076,dancewtsomebody,@RoussiRT jajajajjjaajjjjajajaa eso no lo haces con mi culo  y es de gran valor.,2016-08-31 14:14:00,es,positive,jajajajjjaajjjjajajaa haces culo gran valor
770987884488826880,ElisaZamora,@vodafone_es ha aceptado reembolsarme la cobertura marítima de la que no me advirtió en su momento. Estoy contenta. Me parece justo. ,2016-08-31 14:13:30,es,positive,aceptado reembolsarme cobertura marítima advirtió momento contenta parece justo
770987688551936001,EliseoPaez_G,Típic Te levantas de noche para ir al baño y corres lo más veloz que puedes para que el fantasma no te alcance ,2016-08-31 14:12:43,es,negative,típic levantas noche ir baño corres veloz puedes fantasma alcance
770987552450945028,Rainb0wGravity,Ayay quiero grrabar un trocito de Drown con el ukelele porque tiene que quedar preciosa. Pero tengo la voz fatal ,2016-08-31 14:12:11,es,negative,ayay quiero grrabar trocito drown ukelele quedar preciosa voz fatal
770987505642573824,manal20102,@imanbl_ el unico libro con el que me he echado foto ha sido con el de Yo antes de ti  pero porque el libro es especial!! Jajajaja,2016-08-31 14:12:00,es,neutral,unico libro echado foto sido libro especial jajajaja
771008376960589824,Badeyelloco,bueno bueno bueno voy a hacer el sprite del primer lider de gimnasio de mi fan made ,2016-08-31 15:34:56,es,positive,bueno bueno bueno voy hacer sprite primer lider gimnasio fan made
771006957666861057,BrockmansGin_es,@BenielAnaisabel Y además con unas vistas preciosas... Disfruta de la tarde como se merece ,2016-08-31 15:29:17,es,positive,además unas vistas preciosas disfruta tarde merece
771006781623529473,SauuK,Hoy directillo de FIFA señores! Un poquito de Liverpool que queda menos para terminar ,2016-08-31 15:28:36,es,positive,hoy directillo fifa señores poquito liverpool queda menos terminar
771015391669784576,PacoPorteroOk,"@Antonioortzb @lavuelta @luisangelmate Ojú, que envidia más mala me ha dado!!. Disfruta. Aún me duelen las piernas ¡¡que buena estaba!! ",2016-08-31 16:02:48,es,positive,ojú envidia mala dado disfruta aún duelen piernas buena
771015122122858496,Vicent_Marco,"@batyol @valenciaplaza Gracias por seguirme. Todas las semanas escribo en @culturplaza, cada míercoles para más señas. ",2016-08-31 16:01:44,es,positive,gracias seguirme todas semanas escribo cada míercoles señas
771015060579880961,acalvodelolmo,@vmc1385 Muchas gracias atrasadas!! Esto del Twitter hacia que no lo miraba.... Un abrazoteee!! ,2016-08-31 16:01:29,es,positive,muchas gracias atrasadas twitter hacia miraba abrazoteee
771014583251271681,CliftJose,"@SonrisaChocolat gracias niñuca es preciosa, te prometo que me has alegrado la tarde con este detalle tan Bello y enternecedor. Mil besos ",2016-08-31 15:59:36,es,positive,gracias niñuca preciosa prometo alegrado tarde detalle tan bello enternecedor mil besos
771014290006564864,oyabun,@AGMelendez_ pues si. Pero por lo menos podrían ser actores  puestos a hacer el paripe. Que sean profesionales ,2016-08-31 15:58:26,es,negative,pues si menos podrían ser actores puestos hacer paripe profesionales
771014190526005248,muguruzo94,"@tenistachanel de aquí haciéndolo ""conservadora"" sale una @50 seguro.  a ver como montamos! Thanks por las ideas!",2016-08-31 15:58:02,es,positive,aquí haciéndolo conservadora sale seguro ver montamos thanks ideas
771014163896340484,Lioreuz,"@voicesyntex soy como ese medio demonio que es marginado por los demonios, pero también por los humanos ",2016-08-31 15:57:56,es,negative,medio demonio marginado demonios humanos
770998456752148481,montinini_,@Najeraa13 creo que soy la única que pringa trabajando todo el verano y todo septiembre ,2016-08-31 14:55:31,es,negative,creo única pringa trabajando verano septiembre
771019313310470144,farmaciaatarfe,"31 AGOSTO
 DÍA INTERNACIONAL DE LA SOLIDARIDAD
 Porque la solidaridad comienza con una sonrisa   
 ¡Feliz día! https://t.co/XClh0GSjeG",2016-08-31 16:18:23,es,positive,31 agosto día internacional solidaridad solidaridad comienza sonrisa feliz día httpstcoxclh0gsjeg
771019034498301952,LuismiSanchezz,@julioinsadji Estás muy calladito por aquí julio... q n puedo poner la radio ,2016-08-31 16:17:17,es,negative,calladito aquí julio q n puedo poner radio
771018908149157888,Supraazz,"@HuGo17__ @BayonTHE1 Vamos con PAM que preferimos entrenar vs DDH, teneis muy buen lvl bro ",2016-08-31 16:16:47,es,positive,vamos pam preferimos entrenar vs ddh teneis buen lvl bro
771018869850902528,PeTeTeWorld,"Vamos @ArvenLoL, dales duro como tú sabes  #LoLHonor2",2016-08-31 16:16:38,es,neutral,vamos dales duro sabes lolhonor2
771018763697266688,CliftJose,@miradadelaluna @FinisimaPersona lo vi antes y pensé que era brom si yo fuera mejicano lo construía delante de Tejas  o más. Saludos.,2016-08-31 16:16:12,es,negative,vi pensé brom si mejicano construía delante tejas saludos
771018510378082304,HyundaiEsp,"@fredo_gf Hola, lamentamos leer esto  Por favor, danos todos los detalles en cliente@hyundai.es y te atenderemos lo antes posible. Salu2",2016-08-31 16:15:12,es,negative,hola lamentamos leer favor danos detalles cliente atenderemos posible salu2
771083095655219200,locadelbrocoli,"Terapia de #FirstDates112 si el panorama está así es normal que siga soltera, el problema no soy yo. Me siento mejor ",2016-08-31 20:31:50,es,positive,terapia firstdates112 si panorama así normal siga soltera problema siento mejor
771082813777047552,juanarchilla94,Estoy muerto de hambre pero no puedo hacerme la cena todavía porque está mi compañero de piso cenando y no quiero cenar con él ,2016-08-31 20:30:43,es,negative,muerto hambre puedo hacerme cena todavía compañero piso cenando quiero cenar
771082348989452289,IsaacSrMz,"Que guay, el coca cola music de este año es de Meghan Trainor! Ojalá ser rico ",2016-08-31 20:28:52,es,positive,guay coca cola music año meghan trainor ojalá ser rico
771085904035315712,DeseoLiterario,@anniebooksx tiene que ser entretenido  tu seras la primera en verlo amore mio 😘,2016-08-31 20:43:00,es,positive,ser entretenido seras primera verlo amore mio
771085598140559363,JAVI_PRADA,@VAMPYRES_movie @butfilmfestival uno de nuestros festivales favoritos!! Hemos ido dos veces ,2016-08-31 20:41:47,es,positive,festivales favoritos ido dos veces
771084695488659457,aomatos,@PortalSB_UDLog @CDLaredo @CyDLeonesa estos por lo menos han visto 4 goles ,2016-08-31 20:38:12,es,neutral,menos visto 4 goles
771083892329766913,LuisLorenzoT,"@turu_brujo Mareo y el Molinón siguen en su sitio, todo os parece mal ",2016-08-31 20:35:00,es,negative,mareo molinón siguen sitio parece mal
771083795995000833,cienciabrujula,@angybir @BrujulaOndaCero Gracias! Horarios un poco distintos pero ahí estamos ,2016-08-31 20:34:37,es,positive,gracias horarios distintos ahí
771086980373417984,rubiuslove12,@harleyftprego me gustaría poder ir y abrazarte para que te sientas mejor❤ ,2016-08-31 20:47:16,es,positive,gustaría poder ir abrazarte sientas mejor
771086488859795456,TakkStudio,@Jonbarandica ha sido un acierto muy grande el de anoche ,2016-08-31 20:45:19,es,positive,sido acierto grande anoche
771077610436718594,carropo,"@Ciudadano014 ¡los médicos siempre te dicen cosas horribles, citizen! ",2016-08-31 20:10:02,es,negative,médicos siempre dicen cosas horribles citizen
771077582804623361,_sdnnss,"@Mereeia llévame contigo por fi, que yo también monto y casi siempre sola ",2016-08-31 20:09:56,es,negative,llévame contigo fi monto casi siempre sola
771088620589608961,Martuskiya,@mamiauryner1 espero sobretodo tenerla con mi niño  jajajaja. gracias guapa ♥,2016-08-31 20:53:47,es,positive,espero sobretodo tenerla niño jajajaja gracias guapa
771010006837760000,manal20102,@Omr_dh Tranquilo Omar yo te sigo ahora ,2016-08-31 15:41:24,es,positive,tranquilo omar sigo ahora
771008473450606593,verusverita,"Estupendo discurso de @joanbaldovi en  #SesionDeInvestidura Ché, la ciudadanía ha tenido voz ",2016-08-31 15:35:19,es,positive,estupendo discurso sesiondeinvestidura ché ciudadanía voz
770980246040547328,elcisnenegro06,"@miguela38331844 Que bonito,y yo tengo una sorpresa para Ti ,que te gustara muchísimo!   ",2016-08-31 13:43:09,es,positive,bonitoy sorpresa gustara muchísimo
770979606295932928,OskarGoVi,@Nerea_RMCF93 @OjeraFarlopera_ @aaron_np que guay no? Pobres nosotros simples mortales que no sabemos nada de la vida ,2016-08-31 13:40:36,es,negative,guay pobres simples mortales sabemos vida
770985296007659521,iservia,"Me parece q en esta edicion blogs @iAgua la 4a posicion será la + reñida 
@hidrojing @jcponline @MarinaArnaldosO https://t.co/8HLHYxOX55",2016-08-31 14:03:13,es,neutral,parece q edicion blogs 4a posicion reñida httpstco8hlhyxox55
771010840715755520,Naturea_Cant,@jorgegarzon_  una ruta ideal para disfrutar en familia de los @VallesPasiegos ,2016-08-31 15:44:43,es,positive,ruta ideal disfrutar familia
770975318341451777,naatmaribona_,La gente se descojona de mi cuando me indigno y no se lo toman en serio ,2016-08-31 13:23:34,es,negative,gente descojona indigno toman serio
771006494254985217,aykrmela,@helen_acks Pos sí que eras tú limitada en encontrar formas de no aburrirse en clase ,2016-08-31 15:27:27,es,negative,pos limitada encontrar formas aburrirse clase
771006383735115776,YeOldeNemesis,"@wikkedchild lo veo más que jodido, pero la esperanza nunca se pierde. ",2016-08-31 15:27:01,es,negative,veo jodido esperanza nunca pierde
771000529011048449,quintanapaz,@dexamina Yo he citado varias veces a Heidegger en tuíter y me meto contigo ,2016-08-31 15:03:45,es,negative,citado varias veces heidegger tuíter meto contigo
770983534802632705,itsgeorhero,@perriestheory NO PONGAS COSAS PRIVADAS nah es que me ha molestado en serio ,2016-08-31 13:56:13,es,negative,pongas cosas privadas nah molestado serio
771013039659286528,EmilioMarquez,"@dei_biz Al contrario, me viene genial la corrección para ir mejorando mi inglés ",2016-08-31 15:53:28,es,positive,contrario viene genial corrección ir mejorando inglés
771035873148362752,Jezabelmidnight,"@marionaral @mjdelrio @AcevAsociacion gracias  
Si lo malo de la verdad es que no necesariamente nos hace felices.",2016-08-31 17:24:11,es,neutral,gracias si malo verdad necesariamente hace felices
771040084632203269,myperfectstwins,Menciono a Sofía en cosas bonitas y ella me lo paga bloqueandome por wa ,2016-08-31 17:40:56,es,negative,menciono sofía cosas bonitas paga bloqueandome wa
771039402231472129,muguruzo94,@tenistachanel por eso lo he puesto en comillas.....  pd la yankee ya tiene el fallo de pelocoño pues? ,2016-08-31 17:38:13,es,negative,puesto comillas pd yankee fallo pelocoño pues
771039343381245952,Marimery_97,@_xOshiro Ya no es por bonito o por feo sino porque es un animal con sentimientos tía es horrible ,2016-08-31 17:37:59,es,negative,bonito feo sino animal sentimientos tía horrible
771039103697690624,Iluck_88,Una etapa se cierra y comienza una nueva aventura ,2016-08-31 17:37:02,es,positive,etapa cierra comienza nueva aventura
771002860565848064,conchacornejo,"@sanchezdelreal Sí, es que ya tengo instalada la beta. De momento sólo funcionan en iMessage ",2016-08-31 15:13:01,es,neutral,instalada beta momento sólo funcionan imessage
771002784024031232,SamsungResponde,"@alastrain El primer tuit nos llego a nosotros, por eso te preguntamos tanto  Que tengas un buen día y buena compra.",2016-08-31 15:12:42,es,positive,primer tuit llego preguntamos buen día buena compra
771002156115693568,HectorMann8,Tenemos un presidente que es persona non grata d su ciudad @ahorapodemos nadie s lo va a recordar c una carretera d tercera leña al mono ,2016-08-31 15:10:13,es,negative,presidente persona non grata d ciudad nadie s va recordar c carretera d tercera leña mono
771033276257538048,kortvex,@josebrit sigo sin acostumbrarme a su nueva boca/dientes ,2016-08-31 17:13:52,es,negative,sigo acostumbrarme nueva bocadientes
771037885915099137,AndresMachoXIII,"AY MI MADRE GRIEZMANN 88 en FIFA 17
Toca ahorrar desde ya para hacerme con él ",2016-08-31 17:32:11,es,positive,ay madre griezmann 88 fifa 17 toca ahorrar hacerme
771037503801397248,IgniLefiaSplash,"@IgniLefiaSplash Una vez mi prima me besó sin previo aviso. Ese fue mi primer beso, y nunca he vuelto a tener uno ",2016-08-31 17:30:40,es,neutral,vez prima besó previo aviso primer beso nunca vuelto tener
